{
  "candidateId": "candidate-fib-b2-atari-0004",
  "candidateVersion": "1.0.0",
  "status": "needs-review",
  "source": {
    "sourceId": "falling-in-love-with-baduk",
    "locator": {
      "type": "pdf-page",
      "value": 20
    },
    "usage": "concept_reference"
  },
  "extraction": {
    "method": "manual",
    "extractedAt": "2026-07-09T00:00:00Z",
    "extractor": "codex-reference-author",
    "confidence": 0.8,
    "notes": "Özgün aday; atari fark etmeyi ölçen kısa pedagojik uyarlama."
  },
  "curriculum": {
    "section": "B2",
    "lesson": "l1",
    "skill": "atari-detection",
    "tags": [
      "falling-in-love-with-baduk",
      "b2",
      "atari",
      "tactical"
    ]
  },
  "board": {
    "size": 9,
    "initialStones": [
      {
        "color": "white",
        "x": 4,
        "y": 4
      },
      {
        "color": "black",
        "x": 3,
        "y": 4
      },
      {
        "color": "black",
        "x": 5,
        "y": 4
      },
      {
        "color": "black",
        "x": 4,
        "y": 3
      }
    ],
    "markers": [
      {
        "x": 4,
        "y": 5,
        "label": "tehlike"
      }
    ]
  },
  "task": {
    "type": "construct",
    "prompt": "Bu grubu atari durumuna sokan hamle hangisidir?",
    "expectedAnswer": {
      "x": 4,
      "y": 5
    },
    "answer": {
      "x": 4,
      "y": 5
    },
    "answerPolicy": "single_point_selection",
    "solution": "Aşağıdaki tek boş nokta kapatıldığında beyaz grup tek nefese düşer; bu nedenle grup ataridedir."
  },
  "review": {
    "required": true,
    "reviewer": null,
    "reviewedAt": null,
    "checklist": [
      "source id resolves in catalog",
      "locator resolves to a valid page",
      "board and answer reconstruction are consistent",
      "rights snapshot is attached"
    ]
  },
  "studio": {
    "compatible": true,
    "documentRef": null,
    "proposedStudioDocument": {
      "title": "Atari fark etme aday ?nizlemesi",
      "kind": "problem-candidate"
    }
  },
  "rights": {
    "sourceRightsSnapshot": {
      "licenseStatus": "permission-required",
      "rightsReviewRequired": true,
      "distributionAllowed": false,
      "allowedUse": "reference-only",
      "distributionScope": "none",
      "verificationLevel": "page-reference-only",
      "rightsNote": "No redistributable license was established in this phase."
    },
    "canPublish": false,
    "needsRightsReview": true
  }
}
